{
  "version": 2,
  "account-id": "123456789012",
  "interface-id": "eni-0a1b2c3d4e5f67890",
  "instance-id": "i-0abc1234def567890",
  "vpc-id": "vpc-0123abcd4567efgh8",
  "subnet-id": "subnet-0abc1234def567890",
  "region": "us-east-1",
  "az-id": "use1-az1",

  "srcaddr": "10.0.1.25",
  "dstaddr": "1.2.3.4",
  "srcport": 45678,
  "dstport": 4444,
  "protocol": 6,

  "packets": 12,
  "bytes": 8640,

  "start": 1734172992,
  "end": 1734173012,

  "action": "ACCEPT",
  "log-status": "OK",

  "flow-direction": "egress",
  "type": "IPv4",
  "tcp-flags": 18,
  "traffic-path": 2
}
